{
  "node_id": "arc_hero_confrontation",
  "type": "character_arc",
  "name": "英雄对峙弧线",
  "description": "主角从回避冲突到直面核心矛盾的角色成长弧线",
  "version": "0.1.0",
  "properties": {
    "stages": ["denial", "reluctance", "first_failure", "acceptance", "confrontation"],
    "trigger_event": "mentor_departure_or_loss",
    "emotional_progression": [0.4, 0.3, 0.2, 0.6, 0.9],
    "key_decisions": 3
  },
  "edges": [
    { "relation": "required_by", "target": "pattern_crisis_reveal" },
    { "relation": "paired_with", "target": "archetype_mentor" },
    { "relation": "preceded_by", "target": "arc_ordinary_world" }
  ]
}
