{
  "node_id": "rule_engine",
  "type": "rule",
  "name": "规则引擎（固定底线与可变区间）",
  "version": "3.1.0",
  "description": "定义8个向量在积累期和释放期的固定底线和AI可变区间。包含流转铁律6条和独特性保证机制。",
  "properties": {
    "vector_rules": {
      "F": {"积累期底线":"<0.30","释放期底线":">0.70","可变区间":["[0.05,0.25]积累","[0.75,0.95]释放"]},
      "D_total": {"积累期底线":">0.60","释放期底线":"<0.30"},
      "A": {"块内底线":"≥0.40","可变区间":"[0.40,1000]"},
      "Dir": {"积累期底线":"<-0.50","释放期底线":">+0.50"},
      "T": {"释放期底线":"≥0.70"},
      "Pen": {"呈现期底线":"≥0.70"},
      "B": {"积累期底线":"反派>0.70","释放期底线":"主角>0.70"},
      "P": {"罚后底线":"≥0.50"}
    },
    "flow_iron_rules": [
      "转化路径得分≥1.0",
      "80字炸裂限火克金或木包金，节点≤2",
      "块内FC≥0.5",
      "连续两块FC<0.3预警",
      "乘侮>2.0下块反向操作",
      "憋屈不能连续超过两块",
      "开局序列必须包含至少一次从承受态向爆发态的方向转化(方向因子为正)"
    ],
    "ai_freedom_zones": {
      "可变区间": "在固定底线之上，AI自由选择数值",
      "高能节点": "主干转化路径之间，AI自由编排微观节奏",
      "向量层随机": "AI随机选择保证VD>0.15，不得被取消"
    },
    "uniqueness_guarantee": "VD = Σ|V_book1_i - V_book2_i|/8 > 0.15"
  },
  "edges": [
    {"relation": "applies_to", "target": "desire_matrix"},
    {"relation": "applies_to", "target": "wuxing_flow"},
    {"relation": "applies_to", "target": "precision_framework"},
    {"relation": "part_of", "target": "theory_narrative_dynamics"}
  ]
}
