{
  "node_id": "space_8d",
  "type": "rule",
  "name": "8维概念空间",
  "version": "3.1.0",
  "description": "叙事文本的最小完备度量空间，由8个相互独立维度构成。",
  "properties": {
    "dimensions": {
      "F": {
        "name": "力量感",
        "formula": "目标状态改变幅度 × 不可逆程度 × 难度系数",
        "range": [0, 1],
        "description": "度量主角行为的实际权力和影响力"
      },
      "D_total": {
        "name": "扩展密度",
        "formula": "D_physiological × 0.6 + D_atm × 0.4",
        "range": [0, 1],
        "sub_components": {
          "D_physiological": "身体压抑反应密度 + 沉默句占比 / 2",
          "D_atm": "环境压抑描写密度 + 对话回避/沉默密度 / 2"
        }
      },
      "A": {
        "name": "灵动性",
        "formula": "1000 / (憋屈与爽点事件文本距离 + 1)",
        "range": [0, 1000],
        "note": "A≥1000为秒打脸。A'压缩版用于归一化: 1/(1+e^(-6×(A_norm-0.5)))"
      },
      "P": {
        "name": "持续性",
        "formula": "事件后果被后续章节提及章数 / 总后续章数 + 额外标记加成",
        "range": [0, 1]
      },
      "Dir": {
        "name": "方向性",
        "formula": "(外向句占比 - 内向句占比) / (外向句占比 + 内向句占比 + 0.01)",
        "range": [-1, 1]
      },
      "Pen": {
        "name": "渗透性",
        "formula": "(目标动作触发主角反应概率 + 目标语言穿透深度) / 2",
        "range": [0, 1],
        "penetration_levels": {
          "1.0": "击穿自尊/身份认同",
          "0.7": "触发情绪波动，未击穿核心",
          "0.4": "理性分析，情绪波动轻微",
          "0.1": "被缓冲，无实质影响"
        }
      },
      "B": {
        "name": "边界性",
        "formula": "目标主导句占比 × 0.7 + 主角被动句占比 × 0.3",
        "range": [0, 1]
      },
      "T": {
        "name": "温度",
        "formula": "场景中旁观者反应句数 / 场景总句数",
        "range": [0, 1],
        "description": "度量社会扩散性——事件对外界的冲击程度"
      }
    },
    "energy_function": "E(x) = [F, D_total, A, P, Dir, Pen, B, T]",
    "derived_indicators": {
      "DS": {"name": "双标值", "formula": "(F_inner-F_surface) × |Dir_surface-Dir_inner| × 0.92"},
      "RS": {"name": "规则颠覆性", "formula": "主角触犯规则但未被惩罚次数 / (触犯总次数+1)"},
      "EXP": {"name": "开篇炸裂度", "formula": "向量切换频率×0.4 + DS×0.3 + A×0.2 + T×0.1"},
      "SD": {"name": "爽点密度", "formula": "释放型章节数/总章数"},
      "VD": {"name": "向量差异度", "formula": "Σ|V_book1_i - V_book2_i|/8"}
    }
  },
  "edges": [
    {"relation": "part_of", "target": "theory_narrative_dynamics"},
    {"relation": "basis_for", "target": "trigrams"},
    {"relation": "basis_for", "target": "wuxing_flow"},
    {"relation": "basis_for", "target": "desire_matrix"}
  ]
}
